{
  "epic_key": "PROJ-123",
  "epic_summary": "支付回调幂等能力建设",
  "stories": [
    {
      "summary": "支持支付回调幂等处理",
      "description": "作为支付系统，我希望重复回调不会重复入账，从而保证账务一致性。",
      "labels": ["ai-drafted"],
      "acceptance_criteria": [
        "重复回调不会导致重复记账",
        "异常回调会被记录并可追踪"
      ],
      "dependencies": [
        "依赖现有订单状态查询接口"
      ],
      "risks": [
        "历史数据可能缺少唯一事件标识"
      ],
      "tasks": [
        {
          "summary": "实现支付回调幂等校验逻辑",
          "issue_type": "Task",
          "labels": ["ai-drafted", "codex", "backend"],
          "repo": "payment-service",
          "workdir": "/workspace/payment-service",
          "module_scope": [
            "src/payment/callback_handler.py",
            "src/payment/service.py"
          ],
          "definition_of_done": [
            "重复回调不会重复执行入账逻辑",
            "新增对应单元测试"
          ],
          "acceptance_criteria": [
            "同一事件二次回调时返回成功但不重复写账",
            "失败路径保留错误日志"
          ],
          "execution_hint": "优先检查现有事件ID去重机制，不要修改对外接口契约。",
          "test_command": "pytest tests/payment -q",
          "risk_notes": [
            "若缺少唯一事件ID，需要补充兼容策略"
          ],
          "ai_confidence": 0.86
        }
      ]
    }
  ],
  "questions_for_human": [
    "是否允许引入新的幂等存储表？"
  ]
}
